### ISSUE TITLE
Reaching a network behind the tunnel

### ISSUE THREAD

**Issue by mariusw-42** [DefGuard/defguard#3033]
<img width="1556" height="948" alt="Image" src="https://github.com/user-attachments/assets/3290d3c9-5881-42ce-8fb3-daf8032beb69" />

Hello,
we try to reach a network behind a defguardtunnel, like in the picture 
What already works fine is the purple connection

But pinging the pcs behind it does not work.
What we already tried is settting the allowed IPs for the location to 192.168.6.0/24 
This leads to this routing entries
```
192.168.6.0/24 dev wg0 scope link 
192.168.6.0/24 dev wg proto static scope link metric 50 
```

Also we set  `sudo ip route add 192.168.6.0/24 via  172.16.42.9 ` on the client and on the gateway
which leads to:
```
192.168.6.0/24 via 172.16.42.9 dev wg0 
192.168.6.0/24 dev wg proto static scope link metric 50 
```

In both cases I cannot ping the target.

What I see on the gateway is:
```

12:06:51.789182 wg0   In  IP 172.16.42.15 > 192.168.6.11: ICMP echo request, id 3714, seq 3, length 64
12:06:52.857450 wg0   In  IP 172.16.42.15 > 192.168.6.11: ICMP echo request, id 3714, seq 4, length 64
12:06:53.839387 wg0   In  IP 172.16.42.15 > 192.168.6.11: ICMP echo request, id 3714, seq 5, length 64
12:06:54.861390 wg0   In  IP 172.16.42.15 > 192.168.6.11: ICMP echo request, id 3714, seq 6, length 64
12:06:55.886011 wg0   In  IP 172.16.42.15 > 192.168.6.11: ICMP echo request, id 3714, seq 7, length 64
```

which means the server tries to read the 192.168.6.11 directly, which obviously failes.

So what would be the correct way to set the teltonika in this setup as the correct gateway for the 192.168.6.0/24?

**Comment by j-chmielewski** [comment]
Hi @mariusw-42. One thing caught my eye in the diagram. I suspect it's just a typo, but can you confirm the Teltonika's LAN IP address? The diagram shows both the Teltonika and PC1 using 192.168.6.11. If that's accurate, the two devices would have an IP address conflict, which could cause connectivity issues. I suspect the Teltonika is actually using something like 192.168.6.1, but it's worth verifying first.

Apart from that, the issue appears to be related either to routing between the VPN and LAN subnets or to missing NAT/masquerade configuration on the Teltonika.

Do you have any masquerade/NAT configuration on teltonika to route traffic between the WireGuard and LAN interfaces? Defguard Gateway supports automatic masquerade configuration via the --masquerade option. The relevant documentation can be found here:

https://docs.defguard.net/1.6/features/access-control-list/firewall-internals#masquerade

**Comment by mariusw-42** [comment]
Hello, yes you are completely right, the IP duplicate is a typo, the teltonika has .253 as an IP adress

I tries now setting the  "DEFGUARD_MASQUERADE=true " environment variable, but this results in not being able to ping the gateway server anymore:
My current nftalbes looks like this
`
 Warning: table ip nat is managed by iptables-nft, do not touch!
table ip nat {
	chain DOCKER {
	}

	chain PREROUTING {
		type nat hook prerouting priority dstnat; policy accept;
		fib daddr type local counter packets 14 bytes 1884 jump DOCKER
	}

	chain OUTPUT {
		type nat hook output priority dstnat; policy accept;
		ip daddr != 127.0.0.0/8 fib daddr type local counter packets 0 bytes 0 jump DOCKER
	}

	chain POSTROUTING {
		type nat hook postrouting priority srcnat; policy accept;
		ip saddr 172.17.0.0/16 oifname != "docker0" counter packets 0 bytes 0 masquerade
		ip saddr 172.18.0.0/16 oifname != "br-f4471791f9aa" counter packets 0 bytes 0 masquerade
		ip saddr 172.19.0.0/16 oifname != "br-371555596cd4" counter packets 0 bytes 0 masquerade
		ip saddr 172.20.0.0/16 oifname != "br-3699c3c123d6" counter packets 0 bytes 0 masquerade
	}
}
  Warning: table ip filter is managed by iptables-nft, do not touch!
table ip filter {
	chain DOCKER {
		iifname != "br-3699c3c123d6" oifname "br-3699c3c123d6" counter packets 0 bytes 0 drop
		iifname != "br-371555596cd4" oifname "br-371555596cd4" counter packets 0 bytes 0 drop
		iifname != "br-f4471791f9aa" oifname "br-f4471791f9aa" counter packets 0 bytes 0 drop
		iifname != "docker0" oifname "docker0" counter packets 0 bytes 0 drop
	}

	chain DOCKER-FORWARD {
		counter packets 0 bytes 0 jump DOCKER-CT
		counter packets 0 bytes 0 jump DOCKER-INTERNAL
		counter packets 0 bytes 0 jump DOCKER-BRIDGE
		iifname "br-3699c3c123d6" counter packets 0 bytes 0 accept
		iifname "br-371555596cd4" counter packets 0 bytes 0 accept
		iifname "br-f4471791f9aa" counter packets 0 bytes 0 accept
		iifname "docker0" counter packets 0 bytes 0 accept
	}

	chain DOCKER-BRIDGE {
		oifname "br-3699c3c123d6" counter packets 0 bytes 0 jump DOCKER
		oifname "br-371555596cd4" counter packets 0 bytes 0 jump DOCKER
		oifname "br-f4471791f9aa" counter packets 0 bytes 0 jump DOCKER
		oifname "docker0" counter packets 0 bytes 0 jump DOCKER
	}

	chain DOCKER-CT {
		oifname "br-3699c3c123d6" ct state related,established counter packets 0 bytes 0 accept
		oifname "br-371555596cd4" ct state related,established counter packets 0 bytes 0 accept
		oifname "br-f4471791f9aa" ct state related,established counter packets 0 bytes 0 accept
		oifname "docker0" ct state related,established counter packets 0 bytes 0 accept
	}

	chain DOCKER-INTERNAL {
	}

	chain FORWARD {
		type filter hook forward priority filter; policy drop;
		counter packets 0 bytes 0 jump DOCKER-USER
		counter packets 0 bytes 0 jump DOCKER-FORWARD
	}

	chain DOCKER-USER {
	}
}
 Warning: table ip6 nat is managed by iptables-nft, do not touch!
table ip6 nat {
	chain DOCKER {
	}

	chain PREROUTING {
		type nat hook prerouting priority dstnat; policy accept;
		fib daddr type local counter packets 0 bytes 0 jump DOCKER
	}

	chain OUTPUT {
		type nat hook output priority dstnat; policy accept;
		ip6 daddr != ::1 fib daddr type local counter packets 0 bytes 0 jump DOCKER
	}
}
table ip6 filter {
	chain DOCKER {
	}

	chain DOCKER-FORWARD {
		counter packets 0 bytes 0 jump DOCKER-CT
		counter packets 0 bytes 0 jump DOCKER-INTERNAL
		counter packets 0 bytes 0 jump DOCKER-BRIDGE
	}

	chain DOCKER-BRIDGE {
	}

	chain DOCKER-CT {
	}

	chain DOCKER-INTERNAL {
	}

	chain FORWARD {
		type filter hook forward priority filter; policy accept;
		counter packets 0 bytes 0 jump DOCKER-USER
		counter packets 0 bytes 0 jump DOCKER-FORWARD
	}

	chain DOCKER-USER {
	}
}
table inet DEFGUARD-wg0 {
	chain POSTROUTING {
		type nat hook postrouting priority srcnat; policy accept;
		oifname != "lo" counter packets 45 bytes 3293 masquerade
	}
}
`

**Comment by mariusw-42** [comment]
Well I rebuild the system and build it a little bit different.
where it came to my mind: 
is  needed then, that the teltonika still needs to have allowedips cconfigured to have it get through, but still have then afterwards routing table overwritte  to route 192.168.6.0/24 via the eth interface connected there.
Is this assumption right?
And what would be the proper way to configure that  route automatically, so that it does not get overwritten?

**Comment by mariusw-42** [comment]
I have it now running with wg-quick and this setup:

<img width="1272" height="623" alt="Image" src="https://github.com/user-attachments/assets/82f1caf8-eb7d-4ab7-973f-be6e15995d2d" />

So it seems it is imporant to set custom allowips for the gatewayserver and the teltonika
Is this also possible within defguard?

**Comment by j-chmielewski** [comment]
@mariusw-42 - the topology you're trying to build is effectively a site-to-site WireGuard VPN, where the Teltonika advertises the 192.168.6.0/24 subnet behind it. Unfortunately, Defguard does not currently support site-to-site VPNs.

The gateway configuration (including the WireGuard peer list) is managed by Defguard and synchronized from Core, so any manually added or modified peers will be overwritten during the next configuration update. Because of that, the setup shown in your diagram cannot be implemented reliably with the current version of Defguard.

The good news is that native site-to-site support is already planned for Defguard 2.2. You can track the progress here:

https://github.com/DefGuard/defguard/issues/387

Thank you for taking the time to investigate this. Let me know if you have any further questions or need help with an alternative setup.

**Comment by ptulpen** [comment]
Hello and thanks for the clarification. Then I will look forward for this version.
Do you have a rough estimation when this will be released?

**Comment by j-chmielewski** [comment]
> Do you have a rough estimation when this will be released?

We're currently working on v2.1. 2.2 is not fully scoped yet so it's hard to give any estimates.
This view may be helpful: https://github.com/orgs/DefGuard/projects/5/views/7.

I'm closing the issue for now - feel free to reopen if needed.
